
SQL*Plus: Release 10.2.0.1.0 - Production on Fri Jul 7 12:53:13 2023

Copyright (c) 1982, 2005, Oracle.  All rights reserved.


Connected to:
Oracle Database 10g Enterprise Edition Release 10.2.0.1.0 - Production
With the Partitioning, OLAP and Data Mining options

SQL> set pages 232 lines 232 ;
SQL> select * from tab;

TNAME                          TABTYPE  CLUSTERID
------------------------------ ------- ----------
DEPT                           TABLE
EMP                            TABLE
BONUS                          TABLE
SALGRADE                       TABLE

SQL> select * from emp;

     EMPNO ENAME                     JOB              MGR HIREDATE         SAL       COMM     DEPTNO
---------- ------------------------- --------- ---------- --------- ---------- ---------- ----------
      7890 FDSA
      7369 SMITH                     CLERK           7902 17-DEC-80        800                    20
      7499 ALLEN                     SALESMAN        7698 20-FEB-81       1600        300         30
      7521 WARD                      SALESMAN        7698 22-FEB-81       1250        500         30
      7566 JONES                     MANAGER         7839 02-APR-81       2975                    20
      7654 MARTIN                    SALESMAN        7698 28-SEP-81       1250       1400         30
      7698 BLAKE                     MANAGER         7839 01-MAY-81       2850                    30
      7782 CLARK                     MANAGER         7839 09-JUN-81       2450                    10
      7788 SCOTT                     ANALYST         7566 19-APR-87       3000                    20
      7839 KING                      PRESIDENT            17-NOV-81       5000                    10
      7844 TURNER                    SALESMAN        7698 08-SEP-81       1500          0         30
      7876 ADAMS                     CLERK           7788 23-MAY-87       1100                    20
      7900 JAMES                     CLERK           7698 03-DEC-81        950                    30
      7902 FORD                      ANALYST         7566 03-DEC-81       3000                    20
      7934 MILLER                    CLERK           7782 23-JAN-82       1300                    10

15 rows selected.

SQL> select e.ename,d.dname 
  2  from emp e, dept d
  3  where e.deptno = d.deptno;

ENAME                     DNAME
------------------------- --------------
SMITH                     RESEARCH
ALLEN                     SALES
WARD                      SALES
JONES                     RESEARCH
MARTIN                    SALES
BLAKE                     SALES
CLARK                     ACCOUNTING
SCOTT                     RESEARCH
KING                      ACCOUNTING
TURNER                    SALES
ADAMS                     RESEARCH
JAMES                     SALES
FORD                      RESEARCH
MILLER                    ACCOUNTING

14 rows selected.

SQL> select e.*, b.* 
  2  from emp e cross join bonus b;

no rows selected

SQL> select * from bonus
  2  ;

no rows selected

SQL> select e.*, d.*
  2  from emp e cross join dept d;

     EMPNO ENAME                     JOB              MGR HIREDATE         SAL       COMM     DEPTNO     DEPTNO DNAME          LOC
---------- ------------------------- --------- ---------- --------- ---------- ---------- ---------- ---------- -------------- -------------
      7890 FDSA                                                                                              10 ACCOUNTING     NEW YORK
      7369 SMITH                     CLERK           7902 17-DEC-80        800                    20         10 ACCOUNTING     NEW YORK
      7499 ALLEN                     SALESMAN        7698 20-FEB-81       1600        300         30         10 ACCOUNTING     NEW YORK
      7521 WARD                      SALESMAN        7698 22-FEB-81       1250        500         30         10 ACCOUNTING     NEW YORK
      7566 JONES                     MANAGER         7839 02-APR-81       2975                    20         10 ACCOUNTING     NEW YORK
      7654 MARTIN                    SALESMAN        7698 28-SEP-81       1250       1400         30         10 ACCOUNTING     NEW YORK
      7698 BLAKE                     MANAGER         7839 01-MAY-81       2850                    30         10 ACCOUNTING     NEW YORK
      7782 CLARK                     MANAGER         7839 09-JUN-81       2450                    10         10 ACCOUNTING     NEW YORK
      7788 SCOTT                     ANALYST         7566 19-APR-87       3000                    20         10 ACCOUNTING     NEW YORK
      7839 KING                      PRESIDENT            17-NOV-81       5000                    10         10 ACCOUNTING     NEW YORK
      7844 TURNER                    SALESMAN        7698 08-SEP-81       1500          0         30         10 ACCOUNTING     NEW YORK
      7876 ADAMS                     CLERK           7788 23-MAY-87       1100                    20         10 ACCOUNTING     NEW YORK
      7900 JAMES                     CLERK           7698 03-DEC-81        950                    30         10 ACCOUNTING     NEW YORK
      7902 FORD                      ANALYST         7566 03-DEC-81       3000                    20         10 ACCOUNTING     NEW YORK
      7934 MILLER                    CLERK           7782 23-JAN-82       1300                    10         10 ACCOUNTING     NEW YORK
      7890 FDSA                                                                                              20 RESEARCH       DALLAS
      7369 SMITH                     CLERK           7902 17-DEC-80        800                    20         20 RESEARCH       DALLAS
      7499 ALLEN                     SALESMAN        7698 20-FEB-81       1600        300         30         20 RESEARCH       DALLAS
      7521 WARD                      SALESMAN        7698 22-FEB-81       1250        500         30         20 RESEARCH       DALLAS
      7566 JONES                     MANAGER         7839 02-APR-81       2975                    20         20 RESEARCH       DALLAS
      7654 MARTIN                    SALESMAN        7698 28-SEP-81       1250       1400         30         20 RESEARCH       DALLAS
      7698 BLAKE                     MANAGER         7839 01-MAY-81       2850                    30         20 RESEARCH       DALLAS
      7782 CLARK                     MANAGER         7839 09-JUN-81       2450                    10         20 RESEARCH       DALLAS
      7788 SCOTT                     ANALYST         7566 19-APR-87       3000                    20         20 RESEARCH       DALLAS
      7839 KING                      PRESIDENT            17-NOV-81       5000                    10         20 RESEARCH       DALLAS
      7844 TURNER                    SALESMAN        7698 08-SEP-81       1500          0         30         20 RESEARCH       DALLAS
      7876 ADAMS                     CLERK           7788 23-MAY-87       1100                    20         20 RESEARCH       DALLAS
      7900 JAMES                     CLERK           7698 03-DEC-81        950                    30         20 RESEARCH       DALLAS
      7902 FORD                      ANALYST         7566 03-DEC-81       3000                    20         20 RESEARCH       DALLAS
      7934 MILLER                    CLERK           7782 23-JAN-82       1300                    10         20 RESEARCH       DALLAS
      7890 FDSA                                                                                              30 SALES          CHICAGO
      7369 SMITH                     CLERK           7902 17-DEC-80        800                    20         30 SALES          CHICAGO
      7499 ALLEN                     SALESMAN        7698 20-FEB-81       1600        300         30         30 SALES          CHICAGO
      7521 WARD                      SALESMAN        7698 22-FEB-81       1250        500         30         30 SALES          CHICAGO
      7566 JONES                     MANAGER         7839 02-APR-81       2975                    20         30 SALES          CHICAGO
      7654 MARTIN                    SALESMAN        7698 28-SEP-81       1250       1400         30         30 SALES          CHICAGO
      7698 BLAKE                     MANAGER         7839 01-MAY-81       2850                    30         30 SALES          CHICAGO
      7782 CLARK                     MANAGER         7839 09-JUN-81       2450                    10         30 SALES          CHICAGO
      7788 SCOTT                     ANALYST         7566 19-APR-87       3000                    20         30 SALES          CHICAGO
      7839 KING                      PRESIDENT            17-NOV-81       5000                    10         30 SALES          CHICAGO
      7844 TURNER                    SALESMAN        7698 08-SEP-81       1500          0         30         30 SALES          CHICAGO
      7876 ADAMS                     CLERK           7788 23-MAY-87       1100                    20         30 SALES          CHICAGO
      7900 JAMES                     CLERK           7698 03-DEC-81        950                    30         30 SALES          CHICAGO
      7902 FORD                      ANALYST         7566 03-DEC-81       3000                    20         30 SALES          CHICAGO
      7934 MILLER                    CLERK           7782 23-JAN-82       1300                    10         30 SALES          CHICAGO
      7890 FDSA                                                                                              40 OPERATIONS     BOSTON
      7369 SMITH                     CLERK           7902 17-DEC-80        800                    20         40 OPERATIONS     BOSTON
      7499 ALLEN                     SALESMAN        7698 20-FEB-81       1600        300         30         40 OPERATIONS     BOSTON
      7521 WARD                      SALESMAN        7698 22-FEB-81       1250        500         30         40 OPERATIONS     BOSTON
      7566 JONES                     MANAGER         7839 02-APR-81       2975                    20         40 OPERATIONS     BOSTON
      7654 MARTIN                    SALESMAN        7698 28-SEP-81       1250       1400         30         40 OPERATIONS     BOSTON
      7698 BLAKE                     MANAGER         7839 01-MAY-81       2850                    30         40 OPERATIONS     BOSTON
      7782 CLARK                     MANAGER         7839 09-JUN-81       2450                    10         40 OPERATIONS     BOSTON
      7788 SCOTT                     ANALYST         7566 19-APR-87       3000                    20         40 OPERATIONS     BOSTON
      7839 KING                      PRESIDENT            17-NOV-81       5000                    10         40 OPERATIONS     BOSTON
      7844 TURNER                    SALESMAN        7698 08-SEP-81       1500          0         30         40 OPERATIONS     BOSTON
      7876 ADAMS                     CLERK           7788 23-MAY-87       1100                    20         40 OPERATIONS     BOSTON
      7900 JAMES                     CLERK           7698 03-DEC-81        950                    30         40 OPERATIONS     BOSTON
      7902 FORD                      ANALYST         7566 03-DEC-81       3000                    20         40 OPERATIONS     BOSTON
      7934 MILLER                    CLERK           7782 23-JAN-82       1300                    10         40 OPERATIONS     BOSTON

60 rows selected.

SQL> select count(*) from emp;

  COUNT(*)
----------
        15

SQL> select d.*,e.* 
  2  from emp e cross join emp ;
select d.*,e.*
         *
ERROR at line 1:
ORA-00904: "D": invalid identifier


SQL> select d.*,e.* 
  2  from emp e cross join dept d;

    DEPTNO DNAME          LOC                EMPNO ENAME                     JOB              MGR HIREDATE         SAL       COMM     DEPTNO
---------- -------------- ------------- ---------- ------------------------- --------- ---------- --------- ---------- ---------- ----------
        10 ACCOUNTING     NEW YORK            7890 FDSA
        10 ACCOUNTING     NEW YORK            7369 SMITH                     CLERK           7902 17-DEC-80        800                    20
        10 ACCOUNTING     NEW YORK            7499 ALLEN                     SALESMAN        7698 20-FEB-81       1600        300         30
        10 ACCOUNTING     NEW YORK            7521 WARD                      SALESMAN        7698 22-FEB-81       1250        500         30
        10 ACCOUNTING     NEW YORK            7566 JONES                     MANAGER         7839 02-APR-81       2975                    20
        10 ACCOUNTING     NEW YORK            7654 MARTIN                    SALESMAN        7698 28-SEP-81       1250       1400         30
        10 ACCOUNTING     NEW YORK            7698 BLAKE                     MANAGER         7839 01-MAY-81       2850                    30
        10 ACCOUNTING     NEW YORK            7782 CLARK                     MANAGER         7839 09-JUN-81       2450                    10
        10 ACCOUNTING     NEW YORK            7788 SCOTT                     ANALYST         7566 19-APR-87       3000                    20
        10 ACCOUNTING     NEW YORK            7839 KING                      PRESIDENT            17-NOV-81       5000                    10
        10 ACCOUNTING     NEW YORK            7844 TURNER                    SALESMAN        7698 08-SEP-81       1500          0         30
        10 ACCOUNTING     NEW YORK            7876 ADAMS                     CLERK           7788 23-MAY-87       1100                    20
        10 ACCOUNTING     NEW YORK            7900 JAMES                     CLERK           7698 03-DEC-81        950                    30
        10 ACCOUNTING     NEW YORK            7902 FORD                      ANALYST         7566 03-DEC-81       3000                    20
        10 ACCOUNTING     NEW YORK            7934 MILLER                    CLERK           7782 23-JAN-82       1300                    10
        20 RESEARCH       DALLAS              7890 FDSA
        20 RESEARCH       DALLAS              7369 SMITH                     CLERK           7902 17-DEC-80        800                    20
        20 RESEARCH       DALLAS              7499 ALLEN                     SALESMAN        7698 20-FEB-81       1600        300         30
        20 RESEARCH       DALLAS              7521 WARD                      SALESMAN        7698 22-FEB-81       1250        500         30
        20 RESEARCH       DALLAS              7566 JONES                     MANAGER         7839 02-APR-81       2975                    20
        20 RESEARCH       DALLAS              7654 MARTIN                    SALESMAN        7698 28-SEP-81       1250       1400         30
        20 RESEARCH       DALLAS              7698 BLAKE                     MANAGER         7839 01-MAY-81       2850                    30
        20 RESEARCH       DALLAS              7782 CLARK                     MANAGER         7839 09-JUN-81       2450                    10
        20 RESEARCH       DALLAS              7788 SCOTT                     ANALYST         7566 19-APR-87       3000                    20
        20 RESEARCH       DALLAS              7839 KING                      PRESIDENT            17-NOV-81       5000                    10
        20 RESEARCH       DALLAS              7844 TURNER                    SALESMAN        7698 08-SEP-81       1500          0         30
        20 RESEARCH       DALLAS              7876 ADAMS                     CLERK           7788 23-MAY-87       1100                    20
        20 RESEARCH       DALLAS              7900 JAMES                     CLERK           7698 03-DEC-81        950                    30
        20 RESEARCH       DALLAS              7902 FORD                      ANALYST         7566 03-DEC-81       3000                    20
        20 RESEARCH       DALLAS              7934 MILLER                    CLERK           7782 23-JAN-82       1300                    10
        30 SALES          CHICAGO             7890 FDSA
        30 SALES          CHICAGO             7369 SMITH                     CLERK           7902 17-DEC-80        800                    20
        30 SALES          CHICAGO             7499 ALLEN                     SALESMAN        7698 20-FEB-81       1600        300         30
        30 SALES          CHICAGO             7521 WARD                      SALESMAN        7698 22-FEB-81       1250        500         30
        30 SALES          CHICAGO             7566 JONES                     MANAGER         7839 02-APR-81       2975                    20
        30 SALES          CHICAGO             7654 MARTIN                    SALESMAN        7698 28-SEP-81       1250       1400         30
        30 SALES          CHICAGO             7698 BLAKE                     MANAGER         7839 01-MAY-81       2850                    30
        30 SALES          CHICAGO             7782 CLARK                     MANAGER         7839 09-JUN-81       2450                    10
        30 SALES          CHICAGO             7788 SCOTT                     ANALYST         7566 19-APR-87       3000                    20
        30 SALES          CHICAGO             7839 KING                      PRESIDENT            17-NOV-81       5000                    10
        30 SALES          CHICAGO             7844 TURNER                    SALESMAN        7698 08-SEP-81       1500          0         30
        30 SALES          CHICAGO             7876 ADAMS                     CLERK           7788 23-MAY-87       1100                    20
        30 SALES          CHICAGO             7900 JAMES                     CLERK           7698 03-DEC-81        950                    30
        30 SALES          CHICAGO             7902 FORD                      ANALYST         7566 03-DEC-81       3000                    20
        30 SALES          CHICAGO             7934 MILLER                    CLERK           7782 23-JAN-82       1300                    10
        40 OPERATIONS     BOSTON              7890 FDSA
        40 OPERATIONS     BOSTON              7369 SMITH                     CLERK           7902 17-DEC-80        800                    20
        40 OPERATIONS     BOSTON              7499 ALLEN                     SALESMAN        7698 20-FEB-81       1600        300         30
        40 OPERATIONS     BOSTON              7521 WARD                      SALESMAN        7698 22-FEB-81       1250        500         30
        40 OPERATIONS     BOSTON              7566 JONES                     MANAGER         7839 02-APR-81       2975                    20
        40 OPERATIONS     BOSTON              7654 MARTIN                    SALESMAN        7698 28-SEP-81       1250       1400         30
        40 OPERATIONS     BOSTON              7698 BLAKE                     MANAGER         7839 01-MAY-81       2850                    30
        40 OPERATIONS     BOSTON              7782 CLARK                     MANAGER         7839 09-JUN-81       2450                    10
        40 OPERATIONS     BOSTON              7788 SCOTT                     ANALYST         7566 19-APR-87       3000                    20
        40 OPERATIONS     BOSTON              7839 KING                      PRESIDENT            17-NOV-81       5000                    10
        40 OPERATIONS     BOSTON              7844 TURNER                    SALESMAN        7698 08-SEP-81       1500          0         30
        40 OPERATIONS     BOSTON              7876 ADAMS                     CLERK           7788 23-MAY-87       1100                    20
        40 OPERATIONS     BOSTON              7900 JAMES                     CLERK           7698 03-DEC-81        950                    30
        40 OPERATIONS     BOSTON              7902 FORD                      ANALYST         7566 03-DEC-81       3000                    20
        40 OPERATIONS     BOSTON              7934 MILLER                    CLERK           7782 23-JAN-82       1300                    10

60 rows selected.

SQL> select e.*, d.* 
  2  from emp e cross join dept d
  3  where e.ename = 'SCOTT';

     EMPNO ENAME                     JOB              MGR HIREDATE         SAL       COMM     DEPTNO     DEPTNO DNAME          LOC
---------- ------------------------- --------- ---------- --------- ---------- ---------- ---------- ---------- -------------- -------------
      7788 SCOTT                     ANALYST         7566 19-APR-87       3000                    20         10 ACCOUNTING     NEW YORK
      7788 SCOTT                     ANALYST         7566 19-APR-87       3000                    20         20 RESEARCH       DALLAS
      7788 SCOTT                     ANALYST         7566 19-APR-87       3000                    20         30 SALES          CHICAGO
      7788 SCOTT                     ANALYST         7566 19-APR-87       3000                    20         40 OPERATIONS     BOSTON

SQL> select e.*,d.*
  2  from emp e , dept d
  3  where e.ename = 'SCOTT';

     EMPNO ENAME                     JOB              MGR HIREDATE         SAL       COMM     DEPTNO     DEPTNO DNAME          LOC
---------- ------------------------- --------- ---------- --------- ---------- ---------- ---------- ---------- -------------- -------------
      7788 SCOTT                     ANALYST         7566 19-APR-87       3000                    20         10 ACCOUNTING     NEW YORK
      7788 SCOTT                     ANALYST         7566 19-APR-87       3000                    20         20 RESEARCH       DALLAS
      7788 SCOTT                     ANALYST         7566 19-APR-87       3000                    20         30 SALES          CHICAGO
      7788 SCOTT                     ANALYST         7566 19-APR-87       3000                    20         40 OPERATIONS     BOSTON

SQL> select * from emp ;

     EMPNO ENAME                     JOB              MGR HIREDATE         SAL       COMM     DEPTNO
---------- ------------------------- --------- ---------- --------- ---------- ---------- ----------
      7890 FDSA
      7369 SMITH                     CLERK           7902 17-DEC-80        800                    20
      7499 ALLEN                     SALESMAN        7698 20-FEB-81       1600        300         30
      7521 WARD                      SALESMAN        7698 22-FEB-81       1250        500         30
      7566 JONES                     MANAGER         7839 02-APR-81       2975                    20
      7654 MARTIN                    SALESMAN        7698 28-SEP-81       1250       1400         30
      7698 BLAKE                     MANAGER         7839 01-MAY-81       2850                    30
      7782 CLARK                     MANAGER         7839 09-JUN-81       2450                    10
      7788 SCOTT                     ANALYST         7566 19-APR-87       3000                    20
      7839 KING                      PRESIDENT            17-NOV-81       5000                    10
      7844 TURNER                    SALESMAN        7698 08-SEP-81       1500          0         30
      7876 ADAMS                     CLERK           7788 23-MAY-87       1100                    20
      7900 JAMES                     CLERK           7698 03-DEC-81        950                    30
      7902 FORD                      ANALYST         7566 03-DEC-81       3000                    20
      7934 MILLER                    CLERK           7782 23-JAN-82       1300                    10

15 rows selected.

SQL> select * from tab;

TNAME                          TABTYPE  CLUSTERID
------------------------------ ------- ----------
DEPT                           TABLE
EMP                            TABLE
BONUS                          TABLE
SALGRADE                       TABLE

SQL> create table std (
  2  Sid number(5),
  3  sname varchar2(10),
  4  cid number(2));

Table created.

SQL> create table course(
  2  cid number(2) primary key,
  3  cname varchar2(10) unique not null ,
  4  trainer varchar2(10) not null);

Table created.

SQL> desc course;
 Name                                                                                                                                 Null?    Type
 ------------------------------------------------------------------------------------------------------------------------------------ -------- -----------------------
 CID                                                                                                                                  NOT NULL NUMBER(2)
 CNAME                                                                                                                                NOT NULL VARCHAR2(10)
 TRAINER                                                                                                                              NOT NULL VARCHAR2(10)

SQL> alter table std
  2  modify cid references course(cid);

Table altered.

SQL> insert into course values (1,'Python','Harshad');

1 row created.

SQL> insert into course values (2,'SQL','Greeshma');

1 row created.

SQL> insert into course values(3,'MERN','Kishor');

1 row created.

SQL> insert into course values (4,'Java','Santhosh');

1 row created.

SQL> desc std;
 Name                                                                                                                                 Null?    Type
 ------------------------------------------------------------------------------------------------------------------------------------ -------- -----------------------
 SID                                                                                                                                           NUMBER(5)
 SNAME                                                                                                                                         VARCHAR2(10)
 CID                                                                                                                                           NUMBER(2)

SQL> alter table std
  2  modify (sid primary key,sname not null, cid unique);

Table altered.

SQL> desc std;
 Name                                                                                                                                 Null?    Type
 ------------------------------------------------------------------------------------------------------------------------------------ -------- -----------------------
 SID                                                                                                                                  NOT NULL NUMBER(5)
 SNAME                                                                                                                                NOT NULL VARCHAR2(10)
 CID                                                                                                                                           NUMBER(2)

SQL> alter table std 
  2  modify cid not null;

Table altered.

SQL> desc std;
 Name                                                                                                                                 Null?    Type
 ------------------------------------------------------------------------------------------------------------------------------------ -------- -----------------------
 SID                                                                                                                                  NOT NULL NUMBER(5)
 SNAME                                                                                                                                NOT NULL VARCHAR2(10)
 CID                                                                                                                                  NOT NULL NUMBER(2)

SQL> select * from course;

       CID CNAME      TRAINER
---------- ---------- ----------
         1 Python     Harshad
         2 SQL        Greeshma
         3 MERN       Kishor
         4 Java       Santhosh

SQL> insert into course values(5,'Aptitude','Sreenu');

1 row created.

SQL> select * from emp;

     EMPNO ENAME                     JOB              MGR HIREDATE         SAL       COMM     DEPTNO
---------- ------------------------- --------- ---------- --------- ---------- ---------- ----------
      7890 FDSA
      7369 SMITH                     CLERK           7902 17-DEC-80        800                    20
      7499 ALLEN                     SALESMAN        7698 20-FEB-81       1600        300         30
      7521 WARD                      SALESMAN        7698 22-FEB-81       1250        500         30
      7566 JONES                     MANAGER         7839 02-APR-81       2975                    20
      7654 MARTIN                    SALESMAN        7698 28-SEP-81       1250       1400         30
      7698 BLAKE                     MANAGER         7839 01-MAY-81       2850                    30
      7782 CLARK                     MANAGER         7839 09-JUN-81       2450                    10
      7788 SCOTT                     ANALYST         7566 19-APR-87       3000                    20
      7839 KING                      PRESIDENT            17-NOV-81       5000                    10
      7844 TURNER                    SALESMAN        7698 08-SEP-81       1500          0         30
      7876 ADAMS                     CLERK           7788 23-MAY-87       1100                    20
      7900 JAMES                     CLERK           7698 03-DEC-81        950                    30
      7902 FORD                      ANALYST         7566 03-DEC-81       3000                    20
      7934 MILLER                    CLERK           7782 23-JAN-82       1300                    10

15 rows selected.

SQL> select * from course;

       CID CNAME      TRAINER
---------- ---------- ----------
         1 Python     Harshad
         2 SQL        Greeshma
         3 MERN       Kishor
         4 Java       Santhosh
         5 Aptitude   Sreenu

SQL> select * from std;

no rows selected

SQL> insert into std values (1,'Apple',3);

1 row created.

SQL> insert into std values (2,'Ball',2);

1 row created.

SQL> insert into std values (3,'Cat',3);
insert into std values (3,'Cat',3)
*
ERROR at line 1:
ORA-00001: unique constraint (SCOTT.SYS_C005626) violated


SQL> alter table std
  2  drop unique cid;
drop unique cid
            *
ERROR at line 2:
ORA-00906: missing left parenthesis


SQL> alter table std
  2  drop unique cid;
drop unique cid
            *
ERROR at line 2:
ORA-00906: missing left parenthesis


SQL>  alter table std
  2   drop constraint cid;
 drop constraint cid
                 *
ERROR at line 2:
ORA-02443: Cannot drop constraint  - nonexistent constraint


SQL> select * from std;

       SID SNAME             CID
---------- ---------- ----------
         1 Apple               3
         2 Ball                2

SQL> alter table std
  2  drop cid contraint;
drop cid contraint
     *
ERROR at line 2:
ORA-00905: missing keyword


SQL> alter table std 
  2  drop column cid ;

Table altered.

SQL> alter table std 
  2  add cid number(2) references course(cid);

Table altered.

SQL> update std 
  2  set cid = 1 
  3  where sid = 2;

1 row updated.

SQL> insert into std values(3,'Cat',4);

1 row created.

SQL> select * from std;

       SID SNAME             CID
---------- ---------- ----------
         1 Apple
         2 Ball                1
         3 Cat                 4

SQL> select s.*, c.*
  2  from std s,course c
  3  where c.cid = s.cid;

       SID SNAME             CID        CID CNAME      TRAINER
---------- ---------- ---------- ---------- ---------- ----------
         2 Ball                1          1 Python     Harshad
         3 Cat                 4          4 Java       Santhosh

SQL> update std
  2  set cid = 3
  3  where sid = 1;

1 row updated.

SQL>  select s.*, c.*
  2   from std s,course c
  3   where c.cid = s.cid;

       SID SNAME             CID        CID CNAME      TRAINER
---------- ---------- ---------- ---------- ---------- ----------
         1 Apple               3          3 MERN       Kishor
         2 Ball                1          1 Python     Harshad
         3 Cat                 4          4 Java       Santhosh

SQL> select e.*, d.*
  2  from emp e, ;
from emp e,
           *
ERROR at line 2:
ORA-00903: invalid table name


SQL> select e.*,d.* 
  2  from emp e,dept d
  3  where e.deptno = d.deptno;

     EMPNO ENAME                     JOB              MGR HIREDATE         SAL       COMM     DEPTNO     DEPTNO DNAME          LOC
---------- ------------------------- --------- ---------- --------- ---------- ---------- ---------- ---------- -------------- -------------
      7369 SMITH                     CLERK           7902 17-DEC-80        800                    20         20 RESEARCH       DALLAS
      7499 ALLEN                     SALESMAN        7698 20-FEB-81       1600        300         30         30 SALES          CHICAGO
      7521 WARD                      SALESMAN        7698 22-FEB-81       1250        500         30         30 SALES          CHICAGO
      7566 JONES                     MANAGER         7839 02-APR-81       2975                    20         20 RESEARCH       DALLAS
      7654 MARTIN                    SALESMAN        7698 28-SEP-81       1250       1400         30         30 SALES          CHICAGO
      7698 BLAKE                     MANAGER         7839 01-MAY-81       2850                    30         30 SALES          CHICAGO
      7782 CLARK                     MANAGER         7839 09-JUN-81       2450                    10         10 ACCOUNTING     NEW YORK
      7788 SCOTT                     ANALYST         7566 19-APR-87       3000                    20         20 RESEARCH       DALLAS
      7839 KING                      PRESIDENT            17-NOV-81       5000                    10         10 ACCOUNTING     NEW YORK
      7844 TURNER                    SALESMAN        7698 08-SEP-81       1500          0         30         30 SALES          CHICAGO
      7876 ADAMS                     CLERK           7788 23-MAY-87       1100                    20         20 RESEARCH       DALLAS
      7900 JAMES                     CLERK           7698 03-DEC-81        950                    30         30 SALES          CHICAGO
      7902 FORD                      ANALYST         7566 03-DEC-81       3000                    20         20 RESEARCH       DALLAS
      7934 MILLER                    CLERK           7782 23-JAN-82       1300                    10         10 ACCOUNTING     NEW YORK

14 rows selected.

SQL> select s.*,c.*
  2  from std s, course c
  3  where s.cid = c.cid 
  4  and c.cname='Python';

       SID SNAME             CID        CID CNAME      TRAINER
---------- ---------- ---------- ---------- ---------- ----------
         2 Ball                1          1 Python     Harshad
